{
  "plan_payload_digest": "sha256:c961e134d9fd152950ae8762061e46d23736248fabda3957328859a74a72f68c",
  "producer": {
    "name": "amiss-probe",
    "version": "0.4.0"
  },
  "rows": [
    {
      "checked_at": "2026-08-14T00:00:00Z",
      "destination": "https://example.com/manual",
      "final_destination": "https://example.com/current-manual",
      "kind": "http-probe",
      "method": "get",
      "redirect_chain_permanent": true,
      "status": 410
    }
  ],
  "schema": "amiss/external-evidence"
}
